{
  "version": 2,
  "surface": {
    "handle": "$DSH_SURFACE_ID",
    "directory": "$DSH_SURFACE_DIR",
    "entryPaths": ["surface.md", "inbox/reviews.jsonl"]
  },
  "runtimeView": "$DSH_WORKSURFACE_VIEW_DIR",
  "instruction": "Review case-7 independently and maintain the findings in review.md.",
  "trigger": {
    "name": "review.requested",
    "summary": "The coordinator requested an independent design review for case-7."
  },
  "inputs": [
    {
      "label": "review request",
      "summary": "Question and case identity are in the first inbox record.",
      "detailPath": "$DSH_SURFACE_DIR/inbox/reviews.jsonl"
    }
  ],
  "filePublication": {
    "when": "Publish review.md before emitting review.completed so coordination can read the review.",
    "description": "Publication makes current Surface files available as a durable version. A business output does not publish files; publication is also available when outputs is empty.",
    "command": { "argv": ["$DSH_WORKSURFACE_CLI", "publish", "--key", "review-case-7-files"] }
  },
  "outputs": [
    {
      "name": "review.completed",
      "when": "The independent review is written and its result reference is stable.",
      "payloadSummary": "{ caseId: string, resultRef: string }",
      "schemaPath": "$DSH_WORKSURFACE_VIEW_DIR/contracts/review.completed.json",
      "command": {
        "argv": ["$DSH_WORKSURFACE_CLI", "emit", "review.completed", "--payload", "{\"caseId\":\"case-7\",\"resultRef\":\"review.md\"}"]
      }
    }
  ]
}
